data/search_trends_housing_raw.csv

date,ипотека,ключевая ставка,купить квартиру,новостройки,вторичное жильё,снять квартиру,цены на квартиры,инфляция,курс доллара,вторичное жилье
2018-01-01,2.00,1.00,1.82,3.82,,1.81,4.00,2.00,1.35,77.33
2018-02-01,2.00,2.00,1.82,3.55,,1.89,4.00,1.50,1.35,77.33
2018-03-01,2.00,1.00,1.73,3.27,,1.89,2.00,2.00,1.35,58.00
2018-04-01,2.00,1.00,1.73,3.27,,1.92,2.00,2.00,3.10,77.33
2018-05-01,2.00,1.00,1.67,3.00,,1.92,2.00,2.50,1.74,58.00
2018-06-01,2.00,1.00,1.73,3.00,,2.11,2.00,2.00,1.35,58.00
2018-07-01,2.00,1.00,1.94,3.27,,2.60,4.00,1.00,1.35,58.00
2018-08-01,2.00,1.00,2.10,3.82,,2.91,2.00,1.00,2.71,77.33
2018-09-01,2.00,2.00,2.07,3.55,,2.49,2.00,1.50,2.32,77.33
2018-10-01,2.00,1.00,2.07,3.55,,2.45,2.00,1.50,1.55,58.00
2018-11-01,2.00,1.00,2.04,3.00,,2.15,2.00,2.00,1.55,58.00
2018-12-01,1.00,1.00,1.85,2.73,,1.92,2.00,2.50,1.55,58.00
2019-01-01,2.00,1.00,2.43,3.27,,2.23,4.00,2.00,1.55,77.33
2019-02-01,2.00,1.00,2.28,3.00,,2.08,2.00,2.00,1.35,58.00
2019-03-01,2.00,1.00,2.16,3.00,,2.04,2.00,2.00,1.35,58.00
2019-04-01,1.00,1.00,2.01,2.45,,2.04,2.00,2.00,1.35,58.00
2019-05-01,1.00,1.00,2.01,2.73,,2.08,2.00,2.50,1.16,38.67
2019-06-01,2.00,1.00,1.97,2.73,,2.34,2.00,2.00,1.35,58.00
2019-07-01,2.00,1.00,2.13,3.00,,2.83,4.00,1.00,1.35,58.00
2019-08-01,2.00,1.00,2.43,3.27,,2.91,4.00,1.00,1.74,58.00
2019-09-01,2.00,1.00,2.31,3.00,,2.49,2.00,1.50,1.55,38.67
2019-10-01,2.00,2.00,2.22,3.00,,2.38,2.00,2.00,1.35,58.00
2019-11-01,2.00,1.00,2.16,2.73,,2.19,2.00,2.00,1.16,38.67
2019-12-01,2.00,2.00,1.82,2.18,,1.85,2.00,2.50,1.35,38.67
2020-01-01,2.00,1.00,2.34,3.00,,2.08,2.00,2.00,1.55,38.67
2020-02-01,2.00,2.00,2.34,2.73,,1.92,2.00,2.00,1.74,58.00
2020-03-01,2.00,3.00,2.13,2.45,,1.74,2.00,2.00,8.90,38.67
2020-04-01,2.00,2.00,1.58,2.18,,1.25,2.00,2.50,4.45,38.67
2020-05-01,3.00,1.00,2.13,2.73,,1.58,2.00,2.00,2.52,38.67
2020-06-01,3.00,2.00,2.52,3.00,,2.08,2.00,1.50,2.71,58.00
2020-07-01,3.00,2.00,2.61,3.55,,2.64,2.00,1.50,2.32,58.00
2020-08-01,3.00,1.00,3.04,3.55,,3.21,2.00,1.00,2.71,58.00
2020-09-01,2.00,1.00,2.73,3.27,,2.57,2.00,1.50,3.10,58.00
2020-10-01,2.00,1.00,2.86,3.27,,2.26,2.00,2.00,2.71,58.00
2020-11-01,2.00,1.00,2.76,2.73,,2.19,2.00,2.50,3.29,58.00
2020-12-01,2.00,2.00,2.34,1.91,,1.89,2.00,3.00,2.90,58.00
2021-01-01,2.00,1.00,2.98,3.00,,2.26,4.00,2.00,2.52,58.00
2021-02-01,2.00,1.00,2.92,3.00,,2.08,2.00,2.00,2.32,58.00
2021-03-01,2.00,2.00,2.79,2.73,,2.15,2.00,2.50,2.13,58.00
2021-04-01,2.00,2.00,2.73,2.45,,2.19,2.00,2.50,2.71,58.00
2021-05-01,2.00,1.00,2.49,2.18,,2.26,2.00,2.50,1.94,58.00
2021-06-01,2.00,2.00,2.64,2.45,,2.53,2.00,2.50,2.13,58.00
2021-07-01,2.00,2.00,2.70,2.73,,2.98,2.00,1.50,1.94,58.00
2021-08-01,2.00,1.00,3.04,2.73,,3.77,4.00,1.50,1.55,77.33
2021-09-01,2.00,2.00,2.79,2.45,,2.94,4.00,2.00,1.55,58.00
2021-10-01,2.00,2.00,2.92,2.45,,2.60,2.00,2.50,1.74,58.00
2021-11-01,2.00,2.00,2.70,2.45,,2.30,2.00,3.00,2.13,77.33
2021-12-01,1.00,3.00,2.19,1.91,,1.85,2.00,3.50,1.74,58.00
2022-01-01,2.00,2.00,2.58,2.45,,2.04,4.00,3.50,2.71,58.00
2022-02-01,2.00,13.00,2.34,2.18,,1.81,4.00,4.00,11.23,58.00
2022-03-01,3.00,5.00,2.07,1.64,,2.00,4.00,8.00,19.35,38.67
2022-04-01,2.00,5.00,1.79,1.36,,2.11,2.00,4.50,11.03,38.67
2022-05-01,2.00,5.00,1.82,1.64,,2.15,2.00,3.50,10.65,58.00
2022-06-01,3.00,5.00,2.01,1.64,,2.57,2.00,3.00,7.35,58.00
2022-07-01,2.00,4.00,2.13,1.91,,3.06,2.00,2.00,7.74,58.00
2022-08-01,2.00,2.00,2.43,1.91,,3.09,2.00,2.00,4.26,58.00
2022-09-01,2.00,3.00,2.04,1.64,,2.91,2.00,2.50,3.68,58.00
2022-10-01,2.00,2.00,2.07,1.36,,2.45,2.00,3.00,3.29,58.00
2022-11-01,2.00,2.00,2.10,1.36,,2.15,2.00,3.00,2.13,58.00
2022-12-01,2.00,2.00,1.88,1.36,,1.85,2.00,3.00,3.68,58.00
2023-01-01,2.00,1.00,2.37,1.64,,2.08,2.00,3.00,3.29,58.00
2023-02-01,2.00,2.00,2.34,1.64,,1.92,2.00,2.50,3.48,58.00
2023-03-01,2.00,2.00,2.34,1.91,,2.08,2.00,2.50,3.48,58.00
2023-04-01,2.00,2.00,2.19,1.64,,1.96,2.00,2.50,3.87,58.00
2023-05-01,2.00,1.00,2.19,1.64,,2.11,2.00,3.00,3.48,58.00
2023-06-01,2.00,2.00,2.25,1.64,,2.53,2.00,2.50,4.26,58.00
2023-07-01,2.00,4.00,2.52,2.18,,3.06,2.00,2.00,5.03,58.00
2023-08-01,3.00,8.00,2.64,2.45,,3.47,2.00,2.50,7.16,77.33
2023-09-01,2.00,5.00,2.25,2.18,,2.68,2.00,2.50,4.06,58.00
2023-10-01,2.00,7.00,2.25,1.91,,2.30,2.00,3.00,4.65,58.00
2023-11-01,2.00,4.00,2.10,2.18,,2.15,2.00,3.50,3.87,58.00
2023-12-01,2.00,6.00,1.73,1.64,,1.70,2.00,3.50,3.10,38.67
2024-01-01,2.00,3.00,2.04,1.64,,1.96,2.00,3.00,2.52,58.00
2024-02-01,3.00,4.00,1.82,1.91,,1.77,2.00,3.00,1.94,58.00
2024-03-01,2.00,4.00,1.70,1.64,,1.70,2.00,3.00,1.74,38.67
2024-04-01,2.00,4.00,1.67,1.64,,1.74,2.00,3.00,1.55,38.67
2024-05-01,3.00,3.00,1.64,1.64,,1.74,2.00,3.00,1.35,38.67
2024-06-01,3.00,6.00,1.76,1.91,,2.19,2.00,3.00,2.90,58.00
2024-07-01,4.00,8.00,1.73,1.91,,2.42,2.00,3.00,1.94,58.00
2024-08-01,3.00,4.00,1.79,1.64,,2.68,2.00,2.50,2.32,38.67
2024-09-01,3.00,10.00,1.67,1.91,,2.11,2.00,3.00,1.94,38.67
2024-10-01,3.00,12.00,1.67,1.64,,1.92,2.00,3.50,2.13,38.67
2024-11-01,2.00,6.00,1.67,1.64,,1.81,2.00,4.00,3.68,38.67
2024-12-01,2.00,9.00,1.46,1.36,,1.51,2.00,4.50,3.68,38.67
2025-01-01,3.00,5.00,1.76,1.64,,1.70,2.00,4.00,3.10,58.00
2025-02-01,2.00,8.00,1.61,1.64,,1.47,2.00,3.00,4.84,38.67
2025-03-01,2.00,6.00,1.58,1.36,,1.51,2.00,3.00,4.65,96.67
2025-04-01,2.00,5.00,1.52,1.64,,1.58,2.00,3.00,3.29,58.00
2025-05-01,2.00,4.00,1.61,1.91,,1.62,2.00,2.50,3.10,58.00
2025-06-01,2.00,10.00,1.55,1.64,,1.89,2.00,2.00,2.71,58.00
2025-07-01,2.00,13.00,1.88,2.18,,2.34,2.00,2.00,2.90,58.00
2025-08-01,3.00,9.00,2.19,2.45,,2.57,2.00,2.00,2.52,77.33
2025-09-01,3.00,20.00,2.07,2.45,,2.08,4.00,2.50,2.90,96.67
2025-10-01,3.00,12.00,2.31,3.00,,1.92,2.00,3.00,2.52,96.67
2025-11-01,3.00,6.00,2.95,3.55,,1.85,4.00,3.00,1.94,270.67
2025-12-01,3.00,7.00,2.13,2.45,,1.43,4.00,3.00,2.32,174.00
2026-01-01,3.00,5.00,2.92,2.73,,1.70,4.00,3.50,1.94,232.00
2026-02-01,3.00,8.00,2.89,3.00,,1.70,4.00,3.00,1.74,251.33
2026-03-01,3.00,6.00,2.92,2.73,,1.85,4.00,2.50,2.71,232.00
2026-04-01,3.00,14.00,2.73,2.73,,1.77,4.00,5.50,2.13,212.67
2026-05-01,3.00,8.00,2.34,2.73,,1.77,4.00,8.00,2.13,135.33
2026-06-01,3.00,14.00,2.43,2.73,,2.26,4.00,4.00,2.32,135.33
2026-07-01,3.00,14.00,2.52,2.45,,2.42,4.00,3.00,2.13,116.00
2026-08-01,2.00,5.00,2.46,2.73,,2.30,4.00,4.50,2.32,116.00

papers/Margaritella_New tests of equal forecast accuracy for factor-augmented_2025.md

### **A.2 (Factors and predictors)**

where ˆ **z** _t_ = ( **w**<sup>′</sup> _t_<sup>_,_ˆ</sup> **f** _t_ ′)′. Therefore, to use (2.11) in the ‘for’ loop of Algorithm 1, we additionally obtain<sup>ˆ</sup> **F** _t_ by PCA in

### _2.2.1. Homogeneous weak loadings_

Note that only the terms that depend on **_λ_** _i_ are directly scaled by _N_<sup>−</sup><sup>_α_</sup> . Since (2.15) and (2.16) are functions of the idiosyncratics only, _N/N_<sup>_α_</sup> can be seen as a ‘penalty’ term on the overall rate, as we estimate potentially weaker loadings with principal components. Therefore, we obtain the following decomposition for a row _s_ :

The expression (2.19) is the integral part of the feasible versions of (2.5)–(2.8). To demonstrate their asymptotic equivalence, it is useful to introduce the following quantities:

where _qj_ ( _._ ) is a function, such thatˆ | _qj_ ( _A, B, C, D_ )| = _op_ (1) if _A_ , _B_ , and _C_ are negligible and _ωj_ = ˜ _ωj_ + _op_ (1). Therefore, the asymptotic equivalence holds for _j_ = 1 _, . . . ,_ 4 if (2.20)–(2.23) are negligible. The expansion of all the infeasible statistics can be found in the Online Supplement.

The structure of (2.20)–(2.22) reveals how the behavior of the out-of-sample average of (2.19) dictates the overall asymptotic analysis. For this, we state more assumptions regarding the idiosyncratic components.

Lemma 1 below formalizes the asymptotic behavior of the out-of-sample average of (2.19) by providing the rate of the average square factor approximation error over the recursive samples, when the loadings are weaker. In addition, it provides the uniform rate of the in-sample factor approximation error.

### **Proof.** Online Supplement, Section 3.2.

A.5(i) should be seen as a device to make convergence rates more transparent when the loadings are indeed weaker. Specifically, to prove that _B_ and _C_ in (2.21) and (2.22) are negligible, we need _N_<sup>_<u>Nα</u>_</sup> ~~√~~ <u>1</u> _T_<sup>=</sup><sup>_o_(1)asbefore,</sup> but at the same time _T_<sup>1</sup><sup>_/_4</sup> _N_<sup>_<u>Nα</u>_</sup> ~~√~~ <u>1</u> _T_ = _O_ (1). Thus, under A.4(i), _N_<sup>_<u>Nα</u>_</sup> ~~√~~ <u>1</u> _T_<sup>=</sup><sup>_Op_(</sup><sup>_T_−1</sup><sup>_/_4),whichistheratethatcanbe</sup> incorporated in the subsequent analysis. Requirements in the spirit of A.5(ii) are often met in the PCA literature, and it helps to ensure that the factor estimation error does not accumulate too fast with the expansion of _N_ and _T_ . Here, it is identical to the assumption needed for inference in Lemma 4 of Bai and Ng (2023). Under _α_ = 1 (strong loadings), this naturally coincides with the requirement of √ _TN_<sup>−1</sup> = _o_ (1) in Gonçalves and Perron (2014) or Gonçalves et al. (2017). Both here and in the latter study, this requirement targets sums over an MDS process {(<sup>ˆ</sup> **f** _t_ − **H** _Nt,r_ **f** _t_ ) _ut_ +1}<sup>_T_</sup> _t_ =<sup>−</sup> _k_<sup>1</sup> 0<sup>andmakessurethat</sup> they remain asymptotically negligible. Such terms appear by applying (2.19) to components _B_ and _C_ in (2.21) and (2.22), respectively.

### **Proof.** Online Supplement, Section 4.4.

Parts (i)–(iii) above are enough for _A_ – _C_ of Lemma 3. However, the MDS assumption legitimizes the use of (2.25) as the estimator of _φ_<sup>2</sup> that enters _D_ . The full analysis of HAC-type estimators is beyond the scope of this study. However, under serial dependence, and because ˆ _u_ jecture<sup>2</sup> 2 _,t_ + _h_<sup>=</sup> that<sup>˜</sup><sup>_u_2</sup> 2 _,t_ the+ _h_<sup>+</sup> HAC<sup>_op_(1)</sup> estimator<sup>underour</sup> of<sup>conditions,</sup> _φ_<sup>2</sup> as proposed<sup>wecon-</sup> by both Pitarakis (2023) and Pitarakis (2025) will remain consistent (see also the discussion by Fosten (2016) or Su et al. (2025), where HAC is applied after the first-step factor estimation).

### _2.2.2. Heterogeneous weak loadings_

which does not immediately restrict _α_ ( _αr_ ). Consequently, the rates in Lemma 2 are improved as well. This can be achieved by following (Bai & Ng, 2023) and employing a high-level assumption in A.4(vii). In this case, we do not need to analyze the sums of (2.18) and employ summability conditions on the idiosyncratics (the usual approach, as in e.g. Bai & Ng, 2002). This technique is unavoidable in Lemma 1(i) due to the out-of-sample design. For (ii), instead, we can focus on the norm of the whole time stack, and this gives the same rates as in Proposition 1 of Bai and Ng (2023). Nevertheless, the out-of-sample rates – part (i) of Lemma 1 – dictate the behavior of _A_ – _D_ of Lemma 3. Therefore, _α >_ 0 _._ 5 cannot be dispensed with.

### _3.3. Conditional heteroskedasticity_

In Figs. 9–12, we introduce, on top of the cross-section dependence of the idiosyncratics, conditional heteroskedasticity in the forecast errors _ut_ +1, in the form of a GARCH(1 _,_ 1), as specified above. Throughout the simulations, we still use (2.25) to estimate _φ_<sup>2</sup> . The main effect for all tests is a mild inflation of the size,<sup>12</sup> which is however milder for _g_ ˆ _fadj ,_ 4<sup>comparedto</sup><sup>_g_ˆ</sup> _f ,_ 1<sup>,</sup><sup>_g_</sup> ˆ _fadj ,_ 2<sup>,and</sup><sup>_g_</sup> ˆ _fadj ,_ 3<sup>.Thepower</sup> is instead higher for lower values of the coefficient **_β_**

(e.g. **_β_** = [0 _._ 10 _, . . . ,_ 0 _._ 30]) if compared to the previous results, though this might just be a byproduct of the size increase or of the GARCH time-varying variance structure, which potentially makes certain periods in the sample more informative. At the same time, even though (2.25) estimates unconditional variance, it can be sensitive to conditional heteroskedasticity, especially as it utilizes 4th moments. While a theoretical justification for HAC-type corrections in our testing framework is left for future research, we experimented with the practical implementations proposed by Pitarakis (2023) for _g_ ˆ _f ,_ 1, specifically using Newey–West and Andrews standard errors. These methods demonstrate good empirical performance in our simulations and are thus recommended for practitioners, particularly in settings where conditional heteroskedasticity – such as GARCH-type volatility – is likely present in the forecast errors. The Online Supplement contains heterogeneous weakness results as well.